{
  "schemaVersion": "1.0.0",
  "kind": "w0-runtime-prepare-execution-v1",
  "id": "W0-RUNTIME-PREPARE-{{RUN_ID}}",
  "runId": "{{UNIQUE_W0_VALIDATOR_RUN_ID}}",
  "receiverNonce": "{{BOOTSTRAP_CRYPTOGRAPHIC_NONCE}}",
  "authoritySessionId": "{{TRUSTED_RUNTIME_AUTHORITY_SESSION_ID}}",
  "monitorSessionId": "{{PREPARE_MONITOR_SESSION_ID}}",
  "operatorExpectedConfigSha256": "{{OUT_OF_BAND_OPERATOR_EXPECTED_CONFIG_SHA256}}",
  "configSha256": "{{OPERATOR_CONFIG_SHA256}}",
  "packageSha256": "{{W0_PACKAGE_SHA256}}",
  "projectInputTreeSha256": "{{BOOTSTRAP_COMPLETE_PROJECT_INPUT_TREE_SHA256}}",
  "installedSkillTreeSha256": "{{INSTALLED_SKILL_TREE_SHA256}}",
  "hostExecutableSha256": "{{PINNED_POWERSHELL_EXE_SHA256}}",
  "bootstrapScriptSha256": "{{INSTALLED_W0_RECEIVER_BOOTSTRAP_SHA256}}",
  "hostRuntimeClosureSha256": "{{AUTHORITY_OBSERVED_HOST_RUNTIME_CLOSURE_SHA256}}",
  "argvSha256": "{{AUTHORITY_VERIFIED_CANONICAL_PREPARE_PROTOCOL_ARGV_SHA256}}",
  "cwdSha256": "{{AUTHORITY_OBSERVED_PREPARE_CWD_SHA256}}",
  "envSha256": "{{AUTHORITY_OBSERVED_PREPARE_ENV_SHA256}}",
  "inputIdentitySetSha256": "{{AUTHORITY_OBSERVED_PREPARE_INPUT_IDENTITY_SET_SHA256}}",
  "loadedClosureSha256": "{{AUTHORITY_OBSERVED_PREPARE_LOADED_CLOSURE_SHA256}}",
  "loadedClosureMatchesConfig": true,
  "monitorStartedBeforeProcess": true,
  "enforcementContinuous": true,
  "writePolicy": "only-predeclared-fresh-temp-and-external-challenge-v1",
  "resolvedTempRoot": "{{ABSOLUTE_BOOTSTRAP_FRESH_TEMP_ROOT}}",
  "tempRootIdentity": "{{AUTHORITY_OBSERVED_TEMP_ROOT_IDENTITY}}",
  "resolvedLaunchChallengePath": "{{OPERATOR_EXTERNAL_PREDECLARED_LAUNCH_CHALLENGE_PATH}}",
  "resolvedAuthorizationEvidenceRoot": "{{OPERATOR_EXTERNAL_PREDECLARED_RUN_AUTHORIZATION_ROOT}}",
  "authorizationEvidenceRootIdentity": "{{AUTHORITY_OBSERVED_RUN_AUTHORIZATION_ROOT_IDENTITY}}",
  "launchChallengeSha256": "{{W0_RUNTIME_LAUNCH_CHALLENGE_SHA256}}",
  "challengeFileIdentity": "{{AUTHORITY_OBSERVED_CHALLENGE_FILE_IDENTITY}}",
  "projectPackageSkillWriteCount": 0,
  "pythonStarted": false,
  "startedAt": "{{PREPARE_PROCESS_STARTED_AT}}",
  "completedAt": "{{PREPARE_PROCESS_COMPLETED_AT}}",
  "attestedAt": "{{AUTHORITY_ATTESTED_AT}}",
  "exitCode": 0
}
